{
  "format": "KIP-Cognitive-Capsule",
  "format_version": "2.0-draft",
  "payload": {
    "manifest": {
      "kind": "snapshot",
      "closure": "closed",
      "roots": [
        "C1"
      ]
    },
    "source": {
      "space_id": "S",
      "snapshot_seq": 1
    },
    "schema_dependencies": [
      {
        "package_ref": "kip://profiles/cognitive-memory@2.0.0",
        "content_digest": "sha256:6639aa468d8728a7adf42ae4a306394a06ed69906ee8e29c87c25c06a6a6dd9c"
      }
    ],
    "records": [
      {
        "id": "C1",
        "kind": "concept",
        "space_id": "S",
        "schema_ref": "kip://profiles/cognitive-memory@2.0.0/Person",
        "name": "Alice",
        "attributes": {},
        "_system": {
          "version": 1,
          "state": "active",
          "origin": {
            "principal_id": "owner",
            "channel": "fixture",
            "import_id": null
          }
        }
      }
    ],
    "external_refs": [],
    "blobs": {},
    "handling": {}
  },
  "integrity": {
    "digest_profile": "kip-jcs-safe-v1",
    "content_digest": "sha256:e485889b9cb04bac32e44b3d76b43ac9cb9c27939cebb661d953c10870e6b862",
    "signatures": []
  }
}
